{
  "project": {
    "name": "Vroomly",
    "description": "Vehicle rental marketplace for cars, vans, and scooters with short- and long-term bookings."
  },
  "platform": {
    "targets": ["web"],
    "responsive": true,
    "breakpoints": ["sm", "md", "lg"]
  },
  "fidelity": "production-code",
  "style": {
    "aesthetic": ["minimal", "futuristic"],
    "designSystem": "tailwind",
    "brand": {
      "primaryColor": "#0EA5E9",
      "secondaryColor": "#111827",
      "fontFamily": "Inter"
    },
    "modes": ["light", "dark"]
  },
  "users": {
    "roles": ["customer", "admin", "fleet-manager"],
    "accessControl": true
  },
  "flows": [
    "browse vehicles",
    "search & filter",
    "view vehicle details",
    "booking",
    "checkout & payments",
    "manage bookings",
    "admin fleet CRUD"
  ],
  "integrations": ["maps", "payments", "calendar", "analytics", "auth-oauth"],
  "localization": { "language": "en", "region": "US", "i18n": true },
  "accessibility": {
    "wcag": "AA",
    "features": ["keyboard", "screen-reader", "contrast"]
  },
  "data": {
    "entities": ["Vehicle", "Booking", "User", "PaymentMethod", "Location"],
    "sampleRecordsNeeded": true
  },
  "screens": [
    { "name": "Landing/Home", "priority": 1, "mustHave": true },
    {
      "name": "Vehicle List & Filters",
      "priority": 2,
      "mustHave": true,
      "notes": "Sort by price, rating, distance"
    },
    {
      "name": "Vehicle Detail",
      "priority": 3,
      "mustHave": true,
      "notes": "Photo gallery, map, availability calendar"
    },
    {
      "name": "Booking Flow",
      "priority": 4,
      "mustHave": true,
      "notes": "Date/time pickers, pricing breakdown"
    },
    { "name": "Checkout & Payment", "priority": 5, "mustHave": true },
    { "name": "Profile & Bookings", "priority": 6, "mustHave": true },
    { "name": "Admin: Fleet Management", "priority": 7, "mustHave": false }
  ],
  "output": {
    "format": "code-react",
    "tech": {
      "react": { "useTypescript": true, "useTailwind": true, "state": "none" }
    },
    "deliverables": ["component-files", "story-examples", "readme"],
    "constraints": ["a11y-annotations", "tree-shakeable", "comments-why"]
  }
}
